{"$schema":"https://schemas.cratis.io/factory/v2/artifact-provenance.schema.json","artifactReceiptHash":"sha256:d7194d2490e7703708cd8f9a82f431883e9d94872b0fc3366617ca5ff1228032","contentHash":"sha256:479710f6e9f0bc3ace4a869708a0f998ee459165dc9220139467199c9e28c999","deliveredArtifact":{"$schema":"https://schemas.cratis.io/factory/v2/artifact-descriptor.schema.json","classification":"internal","contentHash":"sha256:495f7f50dd08e5d1dbdf36693c2402014e9f621a98ba769ca7876ae5a7371dbf","documentKind":"artifact-descriptor","kind":"agent-context","mediaType":"application/json","protocolVersion":"2","reference":"artifact:sha256:495f7f50dd08e5d1dbdf36693c2402014e9f621a98ba769ca7876ae5a7371dbf","schema":{"contentHash":"sha256:a0834645aaa41f90f28da5dfdd8628984a56ff342e1fa6854c59a23aac20bb6a","id":"https://schemas.cratis.io/factory/v2/agent-context.schema.json"},"sizeBytes":1280},"documentKind":"artifact-provenance","name":"agent-context","phaseAttemptId":"22222222-2222-4222-8222-222222222222","protocolVersion":"2","runId":"11111111-1111-4111-8111-111111111111","sanitizationAttestationHash":"sha256:06baaeb2712c69c4c8e47138d13cb1d0ccf3921350bb56b2eff11cac38ae036b","securityDomain":"security-domain:sha256:1111111111111111111111111111111111111111111111111111111111111111","source":{"authorityContentHash":"sha256:cccccccccccccccccccccccccccccccccccccccccccccccccccccccccccccccc","compiledWorkflowHash":"sha256:4444444444444444444444444444444444444444444444444444444444444444","kind":"preflight","value":"agent-context","workflowInputId":"agent-context"},"sourceArtifact":{"$schema":"https://schemas.cratis.io/factory/v2/artifact-descriptor.schema.json","classification":"internal","contentHash":"sha256:495f7f50dd08e5d1dbdf36693c2402014e9f621a98ba769ca7876ae5a7371dbf","documentKind":"artifact-descriptor","kind":"agent-context","mediaType":"application/json","protocolVersion":"2","reference":"artifact:sha256:495f7f50dd08e5d1dbdf36693c2402014e9f621a98ba769ca7876ae5a7371dbf","schema":{"contentHash":"sha256:a0834645aaa41f90f28da5dfdd8628984a56ff342e1fa6854c59a23aac20bb6a","id":"https://schemas.cratis.io/factory/v2/agent-context.schema.json"},"sizeBytes":1280}}
